{
  "identifier": "run.vineyard.skillpacks.infra_pivot",
  "content_type": "vineyard:skillpack",
  "name": "Infrastructure pivoting",
  "author": "VINEYARD",
  "description": "Expand one infrastructure indicator (IP/domain/cert) into its connected footprint, one hop at a time.",
  "repo": "Vineyard-Intelligence/skillpack-infrastructure-pivoting",
  "ref": "c09d7301ec20c78db7aaccd515d025da4bcc60b3",
  "path": "skillpacks/infra-pivot.skill.json",
  "version": "2.2.8",
  "applies_to": [
    "infrastructure.ip_address",
    "infrastructure.domain",
    "infrastructure.certificate",
    "infrastructure.autonomous_system"
  ],
  "section_count": 9,
  "requires": []
}
