{
  "identifier": "run.vineyard.skillpacks.account_identity_pivot",
  "content_type": "vineyard:skillpack",
  "name": "Account & identity pivoting",
  "author": "VINEYARD",
  "description": "Turn one account or handle into the person's other accounts, and know when a shared username is NOT the same person.",
  "repo": "Vineyard-Intelligence/skillpack-account-identity-pivoting",
  "ref": "22647564a8390d375bee210aeed0a514f6a875fd",
  "path": "skillpacks/account-pivot.skill.json",
  "version": "3.1.0",
  "applies_to": [
    "identity.handle",
    "identity.account",
    "identity.email_address",
    "identity.person"
  ],
  "section_count": 5,
  "requires": [
    "run.vineyard.pluginpacks.whatsmyname"
  ]
}
